{
  "schema_version": 1,
  "run_id": "7375ef2bcc7711b2",
  "provider": "mock-unified",
  "model": "mock-unified",
  "mode": "unified",
  "channels": [
    "goal",
    "guazi-flow-review"
  ],
  "invocation_count": 1,
  "gf_skill_attested": true,
  "gf_rubric_source": "51bc43b9ca9e0948",
  "packet_hash": "a725b545ad3f1111",
  "packet_path": "handoff/review-packet.json",
  "latency_ms": 700,
  "tokens": {},
  "output_hash": "a0f6a444ce843539",
  "started_at": "2026-07-31T18:31:24Z",
  "finished_at": "2026-07-31T18:31:25Z",
  "fallback_layer": "packet_vertical",
  "review_depth": "light",
  "attempts": [
    {
      "layer": "vertical",
      "fallback_layer": "packet_vertical",
      "provider": "mock-unified",
      "model": "",
      "packet_variant": "scoped",
      "shard_id": "",
      "latency_ms": 22,
      "result": "pass",
      "error": null,
      "error_kind": ""
    }
  ],
  "channel_guard": {
    "has_candidates": true,
    "selected_provider": "mock-unified",
    "selected_model": "mock-unified",
    "downgrade_blocked": false
  }
}